title,price,brand,availability,product_url,price_off
HyperX Procast Microphone,244.0,HyperX,In Stock,https://www.umart.com.au/product/hyperx-procast-microphone-66151,
Blue Microphones Snowball ICE USB Microphone Black,78.0,Blue Microphones,In Stock,https://www.umart.com.au/product/blue-microphones-snowball-ice-usb-microphone-black-39713,4% Off! Save $4.0
Rode NT-USB Versatile Studio Quality USB Microphone,188.0,RODE,In Stock,https://www.umart.com.au/product/rode-nt-usb-versatile-studio-quality-usb-microphone-36841,
Logitech Group Expansion Microphones - 2 Pack,439.0,Logitech,In Stock,https://www.umart.com.au/product/logitech-group-expansion-microphones-2-pack-35308,Save $110.0
Beyerdynamic FOX USB Type C Portable Studio Microphone,195.0,Beyerdynamic,In Stock,https://www.umart.com.au/product/beyerdynamic-fox-usb-type-c-portable-studio-microphone-49924,Save $33.0
Samson Satellite USB Broadcast Microphone,115.0,Samson,In Stock,https://www.umart.com.au/product/samson-satellite-usb-broadcast-microphone-61186,
Razer Seiren Elite Digital USB Microphone,258.0,Razer,In Stock,https://www.umart.com.au/product/razer-seiren-elite-digital-usb-microphone-43470,
Blue Microphones Yeti 3-Capsule USB Microphone - Silver,169.0,Blue Microphones,In Stock,https://www.umart.com.au/product/blue-microphones-yeti-3-capsule-usb-microphone-silver-37101,
Rode Colour Identification Set for NT-USB Mini,9.0,RODE,In Stock,https://www.umart.com.au/product/rode-colour-identification-set-for-nt-usb-mini-58957,47% Off!
Beyerdynamic TGV35DS Dynamic Vocal Microphone w/ 4.5m XLR cable,68.0,Beyerdynamic,In Stock,https://www.umart.com.au/product/beyerdynamic-tgv35ds-dynamic-vocal-microphone-w-4-5m-xlr-cable-43029,
Rode X XCM50 Professional Condenser USB Microphone Designed for Gamers and Streamers,175.0,RODE,In Stock,https://www.umart.com.au/product/rode-x-xcm50-professional-condenser-usb-microphone-designed-for-gamers-and-streamers-65674,Save $54.0
Rode Wireless ME Ultra-compact Wireless Microphone System,199.0,RODE,In Stock,https://www.umart.com.au/product/rode-wireless-me-ultra-compact-wireless-microphone-system-69416,
Wireless Charger 3 in 1 Wireless Charging Station Fast Desk Charging Station for Samsung iPhone AirPods TWS ipad iWatch etc Wireless Charger Stand,21.0,KMart,In Stock,https://www.umart.com.au/product/wireless-charger-3-in-1-wireless-charging-station-fast-desk-charging-station-for-samsung-iphone-airpods-tws-ipad-iwatch-etc-wireless-charger-stand-72676,50% Off!
Blue Microphones Snowball USB Microphone Aluminum,89.0,Blue Microphones,In Stock,https://www.umart.com.au/product/blue-microphones-snowball-usb-microphone-aluminum-68114,10% Off! Save $10.0
Beyerdynamic M 90 PRO X XLR Condenser Microphone,382.0,Beyerdynamic,In Stock,https://www.umart.com.au/product/beyerdynamic-m-90-pro-x-xlr-condenser-microphone-60851,
Generic Somic SM-008 Microphone,13.0,Generic,In Stock,https://www.umart.com.au/product/generic-somic-sm-008-microphone-61952,
Blue Microphones Snowball USB Microphone Black,99.0,Blue Microphones,In Stock,https://www.umart.com.au/product/blue-microphones-snowball-usb-microphone-black-37095,
Blue Yeti Nano USB Microphone - Grey,129.0,Blue Microphones,In Stock,https://www.umart.com.au/product/blue-yeti-nano-usb-microphone-grey-45923,Save $29.0
Samson C01U Pro USB Condenser Mic,89.0,Samson,In Stock,https://www.umart.com.au/product/samson-c01u-pro-usb-condenser-mic-61181,
Blue Microphones Yeti 3 Capsule USB Microphone Blackout,159.0,Blue Microphones,In Stock,https://www.umart.com.au/product/blue-microphones-yeti-3-capsule-usb-microphone-blackout-62896,Save $10.0
Antlion Y Adaptor Antlion Y Adaptor Black,20.0,AntLion,In Stock,https://www.umart.com.au/product/antlion-y-adaptor-antlion-y-adaptor-black-64029,
Blue Microphones Radius III Shock Mount for Yeti and Yeti Pro Black,79.0,Blue Microphones,In Stock,https://www.umart.com.au/product/blue-microphones-radius-iii-shock-mount-for-yeti-and-yeti-pro-black-47069,
HyperX Solocast Microphone,95.0,HyperX,In Stock,https://www.umart.com.au/product/hyperx-solocast-microphone-58485,
Samson Meteorite USB Studio Microphone,52.0,Samson,In Stock,https://www.umart.com.au/product/samson-meteorite-usb-studio-microphone-61182,
Rode PSA1 Professional Studio Boom Arm,125.0,RODE,In Stock,https://www.umart.com.au/product/rode-psa1-professional-studio-boom-arm-36840,Save $23.0
Elgato Wave Shock Mount,65.0,Elgato,In Stock,https://www.umart.com.au/product/elgato-wave-shock-mount-57258,13% Off!
Beyerdynamic M 70 PRO X XLR Dynamic Microphone,277.0,Beyerdynamic,In Stock,https://www.umart.com.au/product/beyerdynamic-m-70-pro-x-xlr-dynamic-microphone-60850,Save $22.0
Samson Go Mic Mobile Handheld Transmitter Only,268.5,Samson,In Stock,https://www.umart.com.au/product/samson-go-mic-mobile-handheld-transmitter-only-61179,
Rode RODECaster Pro II Integrated Audio Production Studio,899.0,RODE,In Stock,https://www.umart.com.au/product/rode-rodecaster-pro-ii-integrated-audio-production-studio-63073,
Saramonic Vmic Mini Condenser Video Microphone for DSLR and Smartphone,79.0,SARAMONIC,In Stock,https://www.umart.com.au/product/saramonic-vmic-mini-condenser-video-microphone-for-dslr-and-smartphone-65097,
SmartMic Di Mini Ultra-Compact Omnidirectional Condenser Microphone with Lightning for iPhones & iPads,65.0,SARAMONIC,In Stock,https://www.umart.com.au/product/smartmic-di-mini-ultra-compact-omnidirectional-condenser-microphone-with-lightning-for-iphones-ipads-65100,
Saramonic Blink 500 RXUC Dual-Channel Wireless USB-C Receiver,120.0,SARAMONIC,In Stock,https://www.umart.com.au/product/saramonic-blink-500-rxuc-dual-channel-wireless-usb-c-receiver-65112,Save $30.0
HyperX DuoCast RGB USB Condenser Microphone Black,159.0,HyperX,In Stock,https://www.umart.com.au/product/hyperx-duocast-rgb-usb-condenser-microphone-black-66142,
Audio Technica AT8703 Microphone Desk Stand,60.0,AudioTechnica,In Stock,https://www.umart.com.au/product/audio-technica-at8703-microphone-desk-stand-71593,
Rode Wireless GO II TX Ultra-Compact Wireless Transmitter Microphone,160.0,RODE,In Stock,https://www.umart.com.au/product/rode-wireless-go-ii-tx-ultra-compact-wireless-transmitter-microphone-74093,
Rode Wireless ME TX Ultra-compact Wireless Microphone System,121.0,RODE,In Stock,https://www.umart.com.au/product/rode-wireless-me-tx-ultra-compact-wireless-microphone-system-74563,
Blue Microphones Snowball USB Microphone White,79.0,Blue Microphones,In Stock,https://www.umart.com.au/product/blue-microphones-snowball-usb-microphone-white-37091,
Blue Microphones Snowball ICE USB Microphone White,79.0,Blue Microphones,In Stock,https://www.umart.com.au/product/blue-microphones-snowball-ice-usb-microphone-white-37099,
Rode DeadMouse Artificial Fur Wind Shield Pin,20.0,RODE,In Stock,https://www.umart.com.au/product/rode-deadmouse-artificial-fur-wind-shield-pin-37594,
Shure SM27 Studio Condenser Cardioid Microphone,613.0,Shure,In Stock,https://www.umart.com.au/product/shure-sm27-studio-condenser-cardioid-microphone-42745,
Rode NTG5 Broadcast Shotgun Microphone Kit,692.0,RODE,In Stock,https://www.umart.com.au/product/rode-ntg5-broadcast-shotgun-microphone-kit-53281,
Audio-Technica Cardioid Condenser Stereo Camera Microphone,61.0,AudioTechnica,In Stock,https://www.umart.com.au/product/audio-technica-cardioid-condenser-stereo-camera-microphone-55768,
Samson SP04TB Shock Mount for G-Track Pro Black,51.0,Samson,In Stock,https://www.umart.com.au/product/samson-sp04tb-shock-mount-for-g-track-pro-black-61184,
Samson Go Mic Mobile Handheld System,270.0,Samson,In Stock,https://www.umart.com.au/product/samson-go-mic-mobile-handheld-system-61232,
Blue Yeti 3 Capsule USB Microphone Sweet Pink,178.5,Blue Microphones,In Stock,https://www.umart.com.au/product/blue-yeti-3-capsule-usb-microphone-sweet-pink-64992,
Saramonic LavMicro+ DC Lavalier Microphone,149.0,SARAMONIC,In Stock,https://www.umart.com.au/product/saramonic-lavmicro-dc-lavalier-microphone-65094,
Saramonic CamMic Lightweight On-Camera Microphone,95.0,SARAMONIC,In Stock,https://www.umart.com.au/product/saramonic-cammic-lightweight-on-camera-microphone-65096,
Saramonic SmartMic UC Mini Microphone for USB Type-C Device,63.0,SARAMONIC,In Stock,https://www.umart.com.au/product/saramonic-smartmic-uc-mini-microphone-for-usb-type-c-device-65101,
Saramonic SR-XM1 Mini Microphone,36.0,SARAMONIC,In Stock,https://www.umart.com.au/product/saramonic-sr-xm1-mini-microphone-65102,
Saramonic SmartMic MTV Smartphone Video Kit,200.0,SARAMONIC,In Stock,https://www.umart.com.au/product/saramonic-smartmic-mtv-smartphone-video-kit-65103,Save $50.0
Saramonic VGM Smartphone/Camera Vlogging and Video Production Kit,159.0,SARAMONIC,In Stock,https://www.umart.com.au/product/saramonic-vgm-smartphone-camera-vlogging-and-video-production-kit-65104,
Saramonic Blink500 B3(TX+RXDi) Wireless Microphone,215.0,SARAMONIC,In Stock,https://www.umart.com.au/product/saramonic-blink500-b3-tx-rxdi-wireless-microphone-65107,
Saramonic Blink 500 RXDi Wireless Lightning Receiver,119.0,SARAMONIC,In Stock,https://www.umart.com.au/product/saramonic-blink-500-rxdi-wireless-lightning-receiver-65111,
Saramonic Blink 500 TX Wireless Clip-On Transmitter,118.0,SARAMONIC,In Stock,https://www.umart.com.au/product/saramonic-blink-500-tx-wireless-clip-on-transmitter-65113,
Saramonic SR-MV2000W USB Multicolor Microphone,270.0,SARAMONIC,In Stock,https://www.umart.com.au/product/saramonic-sr-mv2000w-usb-multicolor-microphone-65115,Save $60.0
HyperX QuadCast S RGB USB Condenser Microphone White,229.0,HyperX,In Stock,https://www.umart.com.au/product/hyperx-quadcast-s-rgb-usb-condenser-microphone-white-66137,Save $15.0
Blue Yeti Nano USB Microphone - Vivid Black,130.0,Blue Microphones,In Stock,https://www.umart.com.au/product/blue-yeti-nano-usb-microphone-vivid-black-68112,
Blue Yeti X Professional USB Microphone - Black,269.0,Blue Microphones,In Stock,https://www.umart.com.au/product/blue-yeti-x-professional-usb-microphone-black-68231,
Wireless collar clip microphone outdoor live recording noise cancellation microphone a drag a wireless microphone,50.0,,In Stock,https://www.umart.com.au/product/wireless-collar-clip-microphone-outdoor-live-recording-noise-cancellation-microphone-a-drag-a-wireless-microphone-69139,
NZXT Wired Mini USB Microphone - White,109.0,NZXT,In Stock,https://www.umart.com.au/product/nzxt-wired-mini-usb-microphone-white-71178,
Blue Microphones Yeti Pro USB and Analog Microphone,359.0,Blue Microphones,In Stock,https://www.umart.com.au/product/blue-microphones-yeti-pro-usb-and-analog-microphone-72109,
Audio-Technica AT2020USB+ USB Recording Microphone,179.0,AudioTechnica,At Other Store,https://www.umart.com.au/product/audio-technica-at2020usb-usb-recording-microphone-31049,
Rode NT1-A 1 inch Cardioid Condenser Microphone,249.0,RODE,Out Of Stock,https://www.umart.com.au/product/rode-nt1-a-1-inch-cardioid-condenser-microphone-36839,
Rode smartLav+ Lavalier Microphone for Smartphones,73.0,RODE,In Stock,https://www.umart.com.au/product/rode-smartlav-lavalier-microphone-for-smartphones-36844,
Blue Microphones Snowball USB Microphone Brushed Aluminium,99.0,Blue Microphones,In Stock,https://www.umart.com.au/product/blue-microphones-snowball-usb-microphone-brushed-aluminium-37093,
Blue Microphones Yeti Pro USB Microphone - Silver,339.0,Blue Microphones,In Stock,https://www.umart.com.au/product/blue-microphones-yeti-pro-usb-microphone-silver-37103,
Rode DeadCat VMP Artificial Fur Wind Shield,36.0,RODE,At Other Store,https://www.umart.com.au/product/rode-deadcat-vmp-artificial-fur-wind-shield-37587,
Rode WS2 Pop Filter / Wind Shield,19.0,RODE,In Stock,https://www.umart.com.au/product/rode-ws2-pop-filter-wind-shield-37605,
Rode VideoMic Me Directional Microphone for Smart Phones,61.0,RODE,In Stock,https://www.umart.com.au/product/rode-videomic-me-directional-microphone-for-smart-phones-37663,
Shure Super 55 Classic Birdcage-Style Dynamic Microphone,471.5,Shure,In Stock,https://www.umart.com.au/product/shure-super-55-classic-birdcage-style-dynamic-microphone-42749,
Shure SM57 Cardioid Instrument Microphone,178.5,Shure,At Other Store,https://www.umart.com.au/product/shure-sm57-cardioid-instrument-microphone-42751,
Shure BETA52A Dynamic Bass Instrument Microphone,298.5,Shure,At Other Store,https://www.umart.com.au/product/shure-beta52a-dynamic-bass-instrument-microphone-44026,
Audio-Technica ATGM1-USB Gooseneck USB Desktop Microphone,59.0,AudioTechnica,In Stock,https://www.umart.com.au/product/audio-technica-atgm1-usb-gooseneck-usb-desktop-microphone-47081,
Infinity MIC-358U USB Microphone - Black,89.0,Infinity,In Stock,https://www.umart.com.au/product/infinity-mic-358u-usb-microphone-black-53575,
Razer Seiren Emote USB Microphone with Emoticons,218.5,Razer,In Stock,https://www.umart.com.au/product/razer-seiren-emote-usb-microphone-with-emoticons-53938,
Audio Technica Content Creator Pack,228.5,AudioTechnica,At Other Store,https://www.umart.com.au/product/audio-technica-content-creator-pack-54136,
Rode NT-USB Mini Studio Quality USB Microphone,135.0,RODE,In Stock,https://www.umart.com.au/product/rode-nt-usb-mini-studio-quality-usb-microphone-54196,
Audio-Technica ATR2500x-USB Cardioid Condenser Microphone,119.0,AudioTechnica,In Stock,https://www.umart.com.au/product/audio-technica-atr2500x-usb-cardioid-condenser-microphone-56339,
Elgato Wave:1 USB Condenser Microphone,159.0,Elgato,In Stock,https://www.umart.com.au/product/elgato-wave-1-usb-condenser-microphone-57257,
Razer Seiren Mini Ultra-Compact Condenser Microphone - Black,75.0,Razer,In Stock,https://www.umart.com.au/product/razer-seiren-mini-ultra-compact-condenser-microphone-black-57352,3% Off! Save $3.0
Razer Seiren Mini Ultra-Compact Condenser Microphone - Quartz,59.0,Razer,At Other Store,https://www.umart.com.au/product/razer-seiren-mini-ultra-compact-condenser-microphone-quartz-57353,
Blue Microphones Yeti 3 Capsule USB Microphone - Midnight Blue,167.0,Blue Microphones,In Stock,https://www.umart.com.au/product/blue-microphones-yeti-3-capsule-usb-microphone-midnight-blue-57536,
Rode VXLR Pro 3.5mm Locking TRS Female to XLR Male Adapter,45.0,RODE,At Other Store,https://www.umart.com.au/product/rode-vxlr-pro-3-5mm-locking-trs-female-to-xlr-male-adapter-58223,
Rode SC17 USB-C to USB-C Flat Cable,25.0,RODE,In Stock,https://www.umart.com.au/product/rode-sc17-usb-c-to-usb-c-flat-cable-58589,
Blue Microphones Snowball iCE Versatile USB Microphone White,78.0,Blue Microphones,In Stock,https://www.umart.com.au/product/blue-microphones-snowball-ice-versatile-usb-microphone-white-60545,
Rode PSA1+ Professional Studio Arm,165.0,RODE,At Other Store,https://www.umart.com.au/product/rode-psa1-professional-studio-arm-60772,
NZXT Capsule Cardioid Wired USB Microphone - Black,139.0,NZXT,In Stock,https://www.umart.com.au/product/nzxt-capsule-cardioid-wired-usb-microphone-black-60848,
NZXT Capsule Cardioid Wired USB Microphone - White,129.0,NZXT,In Stock,https://www.umart.com.au/product/nzxt-capsule-cardioid-wired-usb-microphone-white-60849,
Razer Seiren V2 Pro Professional Grade USB Microphone,209.0,Razer,In Stock,https://www.umart.com.au/product/razer-seiren-v2-pro-professional-grade-usb-microphone-61076,
Samson Recording and Podcasting Pack Microphone,89.0,Samson,At Other Store,https://www.umart.com.au/product/samson-recording-and-podcasting-pack-microphone-61174,
Samson Go Mic Clip on USB Mic,55.0,Samson,In Stock,https://www.umart.com.au/product/samson-go-mic-clip-on-usb-mic-61176,
Samson Go Mic Mobile Lavalier System,248.5,Samson,In Stock,https://www.umart.com.au/product/samson-go-mic-mobile-lavalier-system-61180,
Samson LM8 Lavalier Microphone And Beltpack Transmitter,99.0,Samson,At Other Store,https://www.umart.com.au/product/samson-lm8-lavalier-microphone-and-beltpack-transmitter-61187,
Rode Lavalier II Omnidirectional Clip On Flat Cable Microphone,125.0,RODE,At Other Store,https://www.umart.com.au/product/rode-lavalier-ii-omnidirectional-clip-on-flat-cable-microphone-61637,
HyperX Solocast USB Microphone White,85.0,HyperX,In Stock,https://www.umart.com.au/product/hyperx-solocast-usb-microphone-white-63102,
KROM Kapsule NXKROMKPSL HQ Streaming Microphone Kit,128.5,KROM,In Stock,https://www.umart.com.au/product/krom-kapsule-nxkromkpsl-hq-streaming-microphone-kit-64769,
Audio Technica AT2020USB-X Cardioid Condenser USB Microphone,209.0,AudioTechnica,At Other Store,https://www.umart.com.au/product/audio-technica-at2020usb-x-cardioid-condenser-usb-microphone-64825,
Samson Go Mic Mobile Lavalier System (SWGMMSLAV),189.0,Samson,In Stock,https://www.umart.com.au/product/samson-go-mic-mobile-lavalier-system-swgmmslav-64896,Save $100.0
Blue Yeti 3 Capsule USB Microphone - Sweet Pink,169.0,Blue Microphones,In Stock,https://www.umart.com.au/product/blue-yeti-3-capsule-usb-microphone-sweet-pink-65015,
Elgato Wave:3 Premium USB Condenser Microphone - White,228.0,Elgato,In Stock,https://www.umart.com.au/product/elgato-wave-3-premium-usb-condenser-microphone-white-65379,
Rode X XDM100 Professional Dynamic USB Microphone Designed for Gamers and Streamers,399.0,RODE,In Stock,https://www.umart.com.au/product/rode-x-xdm100-professional-dynamic-usb-microphone-designed-for-gamers-and-streamers-65673,
Simplecom UM350 USB Desktop Microphone,18.0,Simplecom,In Stock,https://www.umart.com.au/product/simplecom-um350-usb-desktop-microphone-66878,
Sonicgear WMC 2000U UHF Wireless Microphone,13.0,Sonicgear,At Other Store,https://www.umart.com.au/product/sonicgear-wmc-2000u-uhf-wireless-microphone-67030,
Rotanium DP01 USB Desktop Microphone,8.0,Rotanium,In Stock,https://www.umart.com.au/product/rotanium-dp01-usb-desktop-microphone-67116,
Brateck MDS15-1 Armoured Microphone Arm - Matte Black,29.0,Brateck,In Stock,https://www.umart.com.au/product/brateck-mds15-1-armoured-microphone-arm-matte-black-69444,
HyperX QuadCast USB Condenser Microphone,199.0,HyperX,In Stock,https://www.umart.com.au/product/hyperx-quadcast-usb-condenser-microphone-69467,
Audio Technica AT8700 Microphone Boom Arm,149.0,AudioTechnica,At Other Store,https://www.umart.com.au/product/audio-technica-at8700-microphone-boom-arm-71591,
Audio Technica AT2040USB Hypercardioid Dynamic USB Microphone,229.0,AudioTechnica,In Stock,https://www.umart.com.au/product/audio-technica-at2040usb-hypercardioid-dynamic-usb-microphone-71597,
Audio Technica AT2020USB-XP USB Condenser Microphone,299.0,AudioTechnica,At Other Store,https://www.umart.com.au/product/audio-technica-at2020usb-xp-usb-condenser-microphone-71603,
Simplecom UM360 Plug and Play USB Desktop Microphone with Headphone Jack,19.0,Simplecom,In Stock,https://www.umart.com.au/product/simplecom-um360-plug-and-play-usb-desktop-microphone-with-headphone-jack-74272,
Blue Yeti Premium Multi-Pattern USB Microphone - Blackout,$199 .00,Blue,In Stock,https://www.jw.com.au/product/blue-yeti-premium-multi-pattern-usb-microphone-blackout-1,
Elgato Wave Mic Arm Low Profile,$149 .00,Elgato,In Stock,https://www.jw.com.au/product/elgato-wave-mic-arm-low-profile,
Logitech Blue Yeti Game Streaming Kit,$197 .01,Logitech,In Stock,https://www.jw.com.au/product/logitech-blue-yeti-game-streaming-kit,$199.00
Simplecom UM360 Plug/Play USB Desktop Microphone,$29 .00,Simplecom,In Stock,https://www.jw.com.au/product/simplecom-um360-plug-play-usb-desktop-microphne,
Audio-Technica AT2020USB+ USB Cardioid Condenser Microphone,$179 .00,Audio-Technica,In Stock,https://www.jw.com.au/product/audio-technica-cardioid-condenser-usb-microphone,
Brateck MABT MDS16 1 Armoured Microphone Arm Black,$44 .55,Brateck,In Stock,https://www.jw.com.au/product/brateck-mabt-mds16-1-armoured-microphone-arm-bk,$59.87
Brateck MABT-MDS15-1 Armoured Microphone Arm,$58 .41,Brateck,In Stock,https://www.jw.com.au/product/brateck-mabt-mds15-1-armoured-microphone-arm,$59.87
Logitech Rally Mic Pod Hub (Splitter),$269 .00,Logitech,In Stock,https://www.jw.com.au/product/logitech-rally-mic-pod-hub-splitter,
Logitech Rally Mic Pod Microphone White,$519 .00,Logitech,In Stock,https://www.jw.com.au/product/logitech-rally-mic-pod-microphone-white,
Audio-Technica AT2020 XLR Microphone,$169 .00,Audio-Technica,In Stock,https://www.jw.com.au/product/audio-technica-at2020-cardioid-condenser-microphone,
Blue Microphones Snowball iCE USB Microphone - Black,$89 .00,Blue,In Stock,https://www.jw.com.au/product/blue-microphones-snowball-ice-usb-microphone-black,
Cougar Screamer-X All Purpose Studio Microphone - RGB Stand,$149 .00,Cougar,In Stock,https://www.jw.com.au/product/cougar-screamer-x-all-purpose-studio-microphone-rgb-stand,
Elgato WAVE Extension Rods,$15 .00,Elgato,In Stock,https://www.jw.com.au/product/elgato-wave-extension-rods,
HP HyperX Quadcast S Microphone,$276 .21,HP,In Stock,https://www.jw.com.au/product/hp-hyperx-quadcast-s-microphone,$299.00
HP HyperX SoloCast Microphone,$109 .00,HP,In Stock,https://www.jw.com.au/product/hp-hyperx-solocast-microphone,
Logitech Rally Mic Pod Accessory,$519 .00,Logitech,In Stock,https://www.jw.com.au/product/logitech-rally-mic-pod-accessory,
(Open Box) Samson Go Lavalier Microphone And Beltpack Transmitter Wireless System for Mobile Video,$119 .96,(Open,In Stock,https://www.jw.com.au/product/open-box-samson-go-lavalier-microphone-and-beltpack-transmitter-wireless-system-for-mobile-video,$149.95
ATEN MicLIVE 6CH AI Audio Mixer,$372 .00,ATEN,In Stock,https://www.jw.com.au/product/aten-miclive-6ch-ai-audio-mixer,
Audio-Technica 2x 3.5mm Jack To USB-C,$39 .95,Audio-Technica,In Stock,https://www.jw.com.au/product/audio-technica-2x-3-5mm-jack-to-usb-c,
Audio-Technica AT2031 Cardioid Condenser Microphone,$199 .00,Audio-Technica,In Stock,https://www.jw.com.au/product/audio-technica-cardioid-condenser-end-address-microphone,
Audio-Technica AT2035 Cardioid Condenser Microphone,$249 .00,Audio-Technica,In Stock,https://www.jw.com.au/product/audio-technica-large-diaphragm-cardioid-condenser-studio-microphone,
Audio-Technica AT2050 Large Diaphragm Multi-Pattern Condenser Microphone,$399 .00,Audio-Technica,In Stock,https://www.jw.com.au/product/audio-technica-large-diaphragm-multi-pattern-condenser,
Audio-Technica AT8703 Microphone Desk Stand,$79 .00,Audio-Technica,In Stock,https://www.jw.com.au/product/audio-technica-at8703-microphone-desk-stand,
Audio-Technica Broadcast Stereo Headset With Dynamic Microphone,$299 .00,Audio-Technica,In Stock,https://www.jw.com.au/product/audio-technica-broadcast-stereo-headset-with-dynamic-microphone,
Audio-Technica Camera Mic Cardioid Settings,$119 .00,Audio-Technica,In Stock,https://www.jw.com.au/product/audio-technica-camera-mic-cardioid-settings,
Audio-Technica Hypercardioid Dynamic Microphone,$299 .00,Audio-Technica,In Stock,https://www.jw.com.au/product/audio-technica-hypercardioid-dynamic-microphone,
Audio-Technica Hypercardioid Dynamic Podcast Microphone,$169 .00,Audio-Technica,In Stock,https://www.jw.com.au/product/audio-technica-hypercardioid-dynamic-podcast-microphone,
Audio-Technica In-line Power Module For ATM350,$125 .00,Audio-Technica,In Stock,https://www.jw.com.au/product/audio-technica-in-line-power-module-for-atm350,
Audio-Technica Large-Diaphragm Dynamic Broadcast Microphone,$599 .00,Audio-Technica,In Stock,https://www.jw.com.au/product/audio-technica-large-diaphragm-dynamic-broadcast-microphone,
Audio-Technica Microphone Clip-on Microphone Black,$49 .95,Audio-Technica,In Stock,https://www.jw.com.au/product/audio-technica-microphone-clip-on-microphone-black,
Audio-Technica Microphone PC Black,$119 .00,Audio-Technica,In Stock,https://www.jw.com.au/product/audio-technica-microphone-pc-black,
Audio-Technica Omnidirectional Condenser Boundary/Lapel Microphone,$38 .83,Audio-Technica,In Stock,https://www.jw.com.au/product/audio-technica-omnidirectional-condenser-boundary-lapel-microphone,
Audio-Technica Omnidirectional Condenser Gooseneck Microphone,$55 .00,Audio-Technica,In Stock,https://www.jw.com.au/product/audio-technica-omnidirectional-condenser-gooseneck-microphone,
Audio-Technica Single-Ear Broadcast Headset With Microphone,$469 .00,Audio-Technica,In Stock,https://www.jw.com.au/product/audio-technica-single-ear-broadcast-headset-with-microphone,
Audio-Technica Stereo Camera Microphone,$99 .95,Audio-Technica,In Stock,https://www.jw.com.au/product/audio-technica-stereo-camera-microphone,
Audio-Technica Studio Microphone Pack - AT2020+AT2021,$229 .00,Audio-Technica,In Stock,https://www.jw.com.au/product/audio-technica-studio-microphone-pack-at2020-at2021,
Audio-Technica Unidirectional Dynamic Vocal/Instrument Microphone - Black,$69 .95,Audio-Technica,In Stock,https://www.jw.com.au/product/audio-technica-unidirectional-dynamic-vocal-instrument-microphone-black,
AVer 10M Expansion Microphone to suit VB342PRO,$421 .87,AVer,Pre-order,https://www.jw.com.au/product/aver-10m-expansion-microphone-to-suit-vb342pro,
Aver Expansion Mic for VB342+ with 10m Cable,$460 .87,Aver,Pre-order,https://www.jw.com.au/product/aver-expansion-mic-for-vb342-with-10m-cable,
Aver VC520PRO Expansion Microphone,$633 .87,Aver,Pre-order,https://www.jw.com.au/product/aver-vc520pro-expansion-microphone,
Avermedia Live Streamer 330 Creator s XLR Mic,$145 .00,Avermedia,In Stock,https://www.jw.com.au/product/avermedia-live-streamer-330-creator-s-xlr-mic,
Avermedia Live Streamer Microphone 350,$349 .00,Avermedia,In Stock,https://www.jw.com.au/product/avermedia-live-streamer-mic-350,
Blue Baby Bottle SL Microphone,$593 .01,Blue,In Stock,https://www.jw.com.au/product/blue-baby-bottle-sl-microphone,$599.95
Blue Microphones Snowball Aluminium USB Microphone,$129 .00,Blue,In Stock,https://www.jw.com.au/product/blue-microphones-snowball-aluminium-usb-microphone,
Blue Microphones Snowball White USB Microphone,$129 .00,Blue,In Stock,https://www.jw.com.au/product/blue-microphones-snowball-white-usb-microphone,
Blue Mics Compass Tube-Style Boom Arm Broadcast - Black,$189 .00,Blue,In Stock,https://www.jw.com.au/product/blue-mics-compass-tube-style-boom-arm-broadcast-black,
